Biography File.	2006-07-19	https://www.federalregister.gov/documents/full_text/xml/2006/07/19/06-6310.xml
National Defense University (NDU) Student Data Files. 	2008-10-01	https://www.federalregister.gov/documents/full_text/xml/2008/10/01/E8-23016.xml
Epidemiologic and Other Health Studies, Surveys and Surveillances. 	2003-06-30	https://www.federalregister.gov/documents/full_text/xml/2003/06/30/03-15351.xml
Department of the Army Civilian Personnel Systems. 	2002-06-25	https://www.federalregister.gov/documents/full_text/xml/2002/06/25/02-15915.xml
Air Force Directory Services (AFDS)	2009-04-06	https://www.federalregister.gov/documents/full_text/xml/2009/04/06/E9-7598.xml
Recall Roster/Locator Records. 	2008-10-01	https://www.federalregister.gov/documents/full_text/xml/2008/10/01/E8-23024.xml
Educator Certification/Recertification Files.	2006-04-21	https://www.federalregister.gov/documents/full_text/xml/2006/04/21/06-3801.xml
Purchase Credit Card Program-VA	2009-03-31	https://www.federalregister.gov/documents/full_text/xml/2009/03/31/E9-7161.xml
Prison Security and Intelligence Record System.	2002-06-18	https://www.federalregister.gov/documents/full_text/xml/2002/06/18/02-15296.xml
OIG Investigative Records—TVA.	2009-03-31	https://www.federalregister.gov/documents/full_text/xml/2009/03/31/E9-7204.xml
Private Collection Agency (PCA) Quality Review Records. 	2006-07-19	https://www.federalregister.gov/documents/full_text/xml/2006/07/19/E6-11400.xml
Inmate Administrative Remedy Record System. 	2002-06-18	https://www.federalregister.gov/documents/full_text/xml/2002/06/18/02-15297.xml
Delete and replace with the following language:, “Statistical Administrative Records System.”	2009-03-25	https://www.federalregister.gov/documents/full_text/xml/2009/03/25/E9-6557.xml
Requests for Freedom of Information Act, Privacy Act, and Mandatory Declassification Review Information.	2006-07-18	https://www.federalregister.gov/documents/full_text/xml/2006/07/18/06-6267.xml
Patent, Copyright, and Data License Proffers, Infringement Claims, and Litigation Files. 	2008-10-01	https://www.federalregister.gov/documents/full_text/xml/2008/10/01/E8-23019.xml
Administrative Claims Record System. 	2002-06-18	https://www.federalregister.gov/documents/full_text/xml/2002/06/18/02-15299.xml
Evaluation of Moving High-Performing Teachers to Low-Performing Schools. 	2009-03-24	https://www.federalregister.gov/documents/full_text/xml/2009/03/24/E9-6445.xml
Supplemental Medical Insurance (SMI) and Hospital Insurance (HI) Premium Accounting Collection and Enrollment (SPACE) System, HHS/CMS/CMM 	2002-06-14	https://www.federalregister.gov/documents/full_text/xml/2002/06/14/02-15004.xml
Employee Building Pass File (EBP) System, HHS/CMS/OICS. 	2002-06-14	https://www.federalregister.gov/documents/full_text/xml/2002/06/14/02-15008.xml
Passports and Visas.	2006-07-18	https://www.federalregister.gov/documents/full_text/xml/2006/07/18/06-6269.xml
Marine Corps Total Force System (MCTFS) Records.	2009-03-23	https://www.federalregister.gov/documents/full_text/xml/2009/03/23/E9-6278.xml
Economic and Manpower Analysis (OEMA) Data Base. 	2008-10-01	https://www.federalregister.gov/documents/full_text/xml/2008/10/01/E8-23017.xml
Pretrial Realtime Information Systems Manager (PRISM).	2003-06-27	https://www.federalregister.gov/documents/full_text/xml/2003/06/27/03-16195.xml
Vehicle Parking Permit and License Control System. 	2008-10-01	https://www.federalregister.gov/documents/full_text/xml/2008/10/01/E8-23022.xml
Physician/Supplier 1099 File (Statement for Recipients of Medical and Health Care Payments)(1099), HHS/CMS/OFM. 	2002-06-14	https://www.federalregister.gov/documents/full_text/xml/2002/06/14/02-15009.xml
Army History Files. 	2002-06-12	https://www.federalregister.gov/documents/full_text/xml/2002/06/12/02-14709.xml
National Finance Center Payroll Personnel System (NFC). 	2006-07-17	https://www.federalregister.gov/documents/full_text/xml/2006/07/17/E6-11235.xml
Department of Defense Biometric Information Systems and Army Information Assurance for Automated Information Systems (AIS). 	2008-10-01	https://www.federalregister.gov/documents/full_text/xml/2008/10/01/E8-23013.xml
Arms Control Inspection Planning System Records. 	2009-03-17	https://www.federalregister.gov/documents/full_text/xml/2009/03/17/E9-5699.xml
NCIS Investigative Files System.	2009-10-13	https://www.federalregister.gov/documents/full_text/xml/2009/10/13/E9-24509.xml
Telecommunications System.	2006-07-11	https://www.federalregister.gov/documents/full_text/xml/2006/07/11/E6-10847.xml
Executive Veterans Affairs Contact Management System (Exec VA)—VA.	2009-03-16	https://www.federalregister.gov/documents/full_text/xml/2009/03/16/E9-5599.xml
Flight Training Candidates File System, FTTTF-001. 	2002-06-10	https://www.federalregister.gov/documents/full_text/xml/2002/06/10/02-14615.xml
Litigation Files—VA (16VA026). 	2009-03-16	https://www.federalregister.gov/documents/full_text/xml/2009/03/16/E9-5596.xml
Defense Industrial Financial Management System (DIFMS) Records. 	2008-10-01	https://www.federalregister.gov/documents/full_text/xml/2008/10/01/E8-23023.xml
Employee Fitness Center Records--NRC.	2009-03-10	https://www.federalregister.gov/documents/full_text/xml/2009/03/10/Z8-31458.xml
Access Request Records. 	2008-10-01	https://www.federalregister.gov/documents/full_text/xml/2008/10/01/E8-23027.xml
	2006-07-06	https://www.federalregister.gov/documents/full_text/xml/2006/07/06/E6-10543.xml
Native Hawaiian Education Council Membership. 	2002-06-06	https://www.federalregister.gov/documents/full_text/xml/2002/06/06/02-14126.xml
Disaster Recovery Assistance Files. 	2006-07-06	https://www.federalregister.gov/documents/full_text/xml/2006/07/06/E6-10640.xml
Privacy Act Request Files. 	2009-02-23	https://www.federalregister.gov/documents/full_text/xml/2009/02/23/E9-3699.xml
Inspector General Investigative and Complaint Files. 	2002-06-04	https://www.federalregister.gov/documents/full_text/xml/2002/06/04/02-13897.xml
Web-Enabled Voting Rights System (WEVRS). 	2006-07-05	https://www.federalregister.gov/documents/full_text/xml/2006/07/05/E6-10369.xml
FedBizOpps (FBO)	2006-06-30	https://www.federalregister.gov/documents/full_text/xml/2006/06/30/06-5902.xml
Archival Purchase Card File. 	2002-06-04	https://www.federalregister.gov/documents/full_text/xml/2002/06/04/02-13896.xml
Defense Debt Management System (DDMS) (June 27, 2002, 67 FR 43292).	2009-02-19	https://www.federalregister.gov/documents/full_text/xml/2009/02/19/E9-3509.xml
Debt Collection and Asset Management System (DCAMS), which consists of two sister systems identified as F71 and F71A. 	2006-06-26	https://www.federalregister.gov/documents/full_text/xml/2006/06/26/E6-10079.xml
Department of the Navy (DON) Education and Training Records.	2009-02-19	https://www.federalregister.gov/documents/full_text/xml/2009/02/19/E9-3508.xml
Personal Clothing Record Files 	2008-10-01	https://www.federalregister.gov/documents/full_text/xml/2008/10/01/E8-23012.xml
Department of Defense Readiness Reporting System (DRRS).	2004-12-10	https://www.federalregister.gov/documents/full_text/xml/2004/12/10/04-27129.xml
Defense Criminal Investigation DNA Database and Sample Repository; CODIS Records.	2009-02-17	https://www.federalregister.gov/documents/full_text/xml/2009/02/17/E9-3372.xml
NSA/CSS Drug Testing Program. 	2008-10-01	https://www.federalregister.gov/documents/full_text/xml/2008/10/01/E8-23021.xml
Health Program Evaluation—VA. 	2007-03-21	https://www.federalregister.gov/documents/full_text/xml/2007/03/21/E7-5135.xml
Uniformed Services University of the Health Sciences (USUHS) Student Records	2009-02-10	https://www.federalregister.gov/documents/full_text/xml/2009/02/10/E9-2762.xml
Standard Installation/Division Personnel System (SIDPERS).	2002-05-31	https://www.federalregister.gov/documents/full_text/xml/2002/05/31/02-13594.xml
Defense Bone Marrow Donor Program. 	2009-02-10	https://www.federalregister.gov/documents/full_text/xml/2009/02/10/E9-2790.xml
Defense Integrated Military Human Resources System (DIMHRS) Records. 	2008-09-30	https://www.federalregister.gov/documents/full_text/xml/2008/09/30/E8-22841.xml
Legal Records System (February 22, 1993, 58 FR 10770)., Reason:,  As a result of realignment, Navy hospitals no longer report to the Bureau of Medicine and Surgery. Accordingly, their legal office records are covered under a variety of other Navy legal systems. Hence, a separate distinct system for BUMED and the hospitals is no longer needed.	2002-05-29	https://www.federalregister.gov/documents/full_text/xml/2002/05/29/02-13296.xml
Marine Corps Aircrew Performance Qualification Records. 	2009-02-10	https://www.federalregister.gov/documents/full_text/xml/2009/02/10/E9-2796.xml
Army Science Board (ASB) Files.	2006-04-21	https://www.federalregister.gov/documents/full_text/xml/2006/04/21/06-3804.xml
Employee Complaint and Allegation Referral Records. 	2002-05-28	https://www.federalregister.gov/documents/full_text/xml/2002/05/28/02-13253.xml
Research.gov (NSF-72). 	2007-10-17	https://www.federalregister.gov/documents/full_text/xml/2007/10/17/E7-20485.xml
Computer/Electronic Accommodations Program for People with Disabilities.	2006-06-21	https://www.federalregister.gov/documents/full_text/xml/2006/06/21/06-5551.xml
Medicare Savings Programs Information System, Social Security Administration, Office of Program Benefits. 	2002-05-17	https://www.federalregister.gov/documents/full_text/xml/2002/05/17/02-12364.xml
Single Family Acquired Asset Management System (SAMS—A80S) 	2006-06-20	https://www.federalregister.gov/documents/full_text/xml/2006/06/20/E6-9600.xml
Uniformed Services Identification Card. 	2002-05-15	https://www.federalregister.gov/documents/full_text/xml/2002/05/15/02-12057.xml
Child Development Services. 	2002-05-15	https://www.federalregister.gov/documents/full_text/xml/2002/05/15/02-12055.xml
Recall Roster/Locator Records (July 6, 2005, 70 FR 38892)	2013-07-26	https://www.federalregister.gov/documents/full_text/xml/2013/07/26/2013-17986.xml
Air Force Inactive Duty Training Records.	2009-01-23	https://www.federalregister.gov/documents/full_text/xml/2009/01/23/E9-1411.xml
Global Enrollment System (GES). 	2006-04-21	https://www.federalregister.gov/documents/full_text/xml/2006/04/21/E6-5968.xml
TRIO Programs Annual Performance Report (APR) System (TRIO APR). 	2009-01-23	https://www.federalregister.gov/documents/full_text/xml/2009/01/23/E9-1261.xml
Law Enforcement Information Database (LEIDB)/Pathfinder 	2008-09-30	https://www.federalregister.gov/documents/full_text/xml/2008/09/30/E8-22612.xml
Personal Commercial Solicitation Evaluation.	2006-06-19	https://www.federalregister.gov/documents/full_text/xml/2006/06/19/06-5491.xml
Geographically Separated Unit Copy Officer Effectiveness/Airman Effectiveness Performance Report (June 11, 1997, 62 FR 31793). 	2009-01-22	https://www.federalregister.gov/documents/full_text/xml/2009/01/22/E9-1238.xml
Administrative Protective Order Breach and Related Records. 	2006-06-19	https://www.federalregister.gov/documents/full_text/xml/2006/06/19/06-5523.xml
Mailing Management Systems. 	2006-06-19	https://www.federalregister.gov/documents/full_text/xml/2006/06/19/E6-9581.xml
Security/Access Badges. 	2002-05-10	https://www.federalregister.gov/documents/full_text/xml/2002/05/10/02-11669.xml
Biographical Data and Automated Personnel Management System 	2009-01-22	https://www.federalregister.gov/documents/full_text/xml/2009/01/22/E9-1229.xml
Reservists Recall Files. 	2002-05-09	https://www.federalregister.gov/documents/full_text/xml/2002/05/09/02-11534.xml
Freedom of Information Act and Privacy Act Case Files. 	2006-06-19	https://www.federalregister.gov/documents/full_text/xml/2006/06/19/E6-9580.xml
Office Functional Files.	2006-06-16	https://www.federalregister.gov/documents/full_text/xml/2006/06/16/06-5453.xml
Missile Defense Data Center Catalog System Records.	2008-12-15	https://www.federalregister.gov/documents/full_text/xml/2008/12/15/E8-29526.xml
Earth Observing System Data and Information System (EOSDIS) User Information. 	2007-10-03	https://www.federalregister.gov/documents/full_text/xml/2007/10/03/E7-19541.xml
Drug-Free Workplace Program Records. 	2002-05-07	https://www.federalregister.gov/documents/full_text/xml/2002/05/07/02-10994.xml
Citizen Corps Database.	2002-05-07	https://www.federalregister.gov/documents/full_text/xml/2002/05/07/02-11253.xml
Transportation Security Intelligence Service (TSIS) Operations Files 	2004-12-10	https://www.federalregister.gov/documents/full_text/xml/2004/12/10/04-27096.xml
Teacher Correspondence Files (May 14, 1997, 62 FR 26483)., Reason: The records contained in this system of records are covered by OPM/GOVT-5 (Recruiting, Examining and Placement Records), a government wide system notice.	2006-06-16	https://www.federalregister.gov/documents/full_text/xml/2006/06/16/06-5455.xml
Administrative Claims, HHS/OS/OGC. 	2004-12-09	https://www.federalregister.gov/documents/full_text/xml/2004/12/09/04-27008.xml
Personnel Security Files—FCA. 	2006-06-15	https://www.federalregister.gov/documents/full_text/xml/2006/06/15/E6-9356.xml
Aviation Records on Individuals. 	2008-09-29	https://www.federalregister.gov/documents/full_text/xml/2008/09/29/E8-22775.xml
Indian Health Service Medical Staff Credentials and Privileges Records, HHS/IHS/OCPS.	2006-06-15	https://www.federalregister.gov/documents/full_text/xml/2006/06/15/06-5410.xml
AVUE Technologies Position Management, Recruitment, Retention and Staffing Module (PMRRS).	2006-06-14	https://www.federalregister.gov/documents/full_text/xml/2006/06/14/06-5402.xml
Redesigned Naturalization Application Casework System (RNACS). 	2002-04-29	https://www.federalregister.gov/documents/full_text/xml/2002/04/29/02-10398.xml
Mass Transportation Fringe Benefit Program—Outside the National Capital Region.	2006-06-14	https://www.federalregister.gov/documents/full_text/xml/2006/06/14/06-5405.xml
Administrative Personnel Management System. 	2006-06-14	https://www.federalregister.gov/documents/full_text/xml/2006/06/14/06-5395.xml
The Office of Inspector General Management Information System (MIS) (71VA53).	2008-09-29	https://www.federalregister.gov/documents/full_text/xml/2008/09/29/E8-22776.xml
Defense Manpower Data Center Data Base. 	2002-04-26	https://www.federalregister.gov/documents/full_text/xml/2002/04/26/02-10282.xml
Recruiting Enlisted Selection System. 	2006-06-14	https://www.federalregister.gov/documents/full_text/xml/2006/06/14/06-5398.xml
Opioid Treatment Waiver Notification System.	2002-04-25	https://www.federalregister.gov/documents/full_text/xml/2002/04/25/02-10261.xml
Navy College Management Information System. 	2002-04-24	https://www.federalregister.gov/documents/full_text/xml/2002/04/24/02-9961.xml
Library Network (VALNET)-VA.	2008-09-24	https://www.federalregister.gov/documents/full_text/xml/2008/09/24/E8-22353.xml
Per Diem and Travel Payment System (February 22, 1993, 58 FR 10630)., Reason: The system of records is maintained under Defense Finance and Accounting Service (DFAS) systems of records notice T7333, entitled, Travel Payment System (September 19, 2005, 70 FR 54906).	2006-06-14	https://www.federalregister.gov/documents/full_text/xml/2006/06/14/06-5401.xml
Operations Training Development Evaluation (June 11, 1997, 62 FR 31793). , Reason:,  Records in this system of records are retrieved by crew position, not a personal identifier. Therefore, the system of records is no longer subject to the Privacy Act of 1974 and is being deleted from the Department of the Air Forces' inventory of systems of records notices subject to the Privacy Act of 1974. 	2002-04-16	https://www.federalregister.gov/documents/full_text/xml/2002/04/16/02-9181.xml
Voluntary Leave Transfer Program Records. 	2006-06-12	https://www.federalregister.gov/documents/full_text/xml/2006/06/12/06-5290.xml
Interior Relocation Assistance Program Records, DOII-02. 	2008-09-24	https://www.federalregister.gov/documents/full_text/xml/2008/09/24/E8-22425.xml
Volunteer Files. 	2007-10-03	https://www.federalregister.gov/documents/full_text/xml/2007/10/03/E7-19351.xml
The INTERPOL-United States National Central Bureau (USNCB) Records System, JUSTICE/INTERPOL-001. 	2002-04-10	https://www.federalregister.gov/documents/full_text/xml/2002/04/10/02-8427.xml
FRB—Transportation Subsidy Records. 	2008-09-22	https://www.federalregister.gov/documents/full_text/xml/2008/09/22/E8-22016.xml
Marine Corps Military Personnel Records (OQR/SRB)(October 13, 2000, 65 FR 60914) 	2002-04-08	https://www.federalregister.gov/documents/full_text/xml/2002/04/08/02-8239.xml
Office of Workers' Compensation Programs, Federal Employees' Compensation Act File. 	2002-04-08	https://www.federalregister.gov/documents/full_text/xml/2002/04/08/02-7376.xml
USGS, USGS-01, “National Water Information System: NWIS”.	2008-09-19	https://www.federalregister.gov/documents/full_text/xml/2008/09/19/E8-21913.xml
Voluntary Leave Transfer Program Record (June 16, 2003, 68 FR 35636).	2006-06-05	https://www.federalregister.gov/documents/full_text/xml/2006/06/05/06-5086.xml
Form EIA-457 Survey Reports, Residential Energy Consumption Survey (RECS). 	2006-04-19	https://www.federalregister.gov/documents/full_text/xml/2006/04/19/E6-5892.xml
Occupational Health Records. 	2002-03-29	https://www.federalregister.gov/documents/full_text/xml/2002/03/29/02-7540.xml
Security Identification Accountability Files (February 22, 1993, 58 FR 10189).	2002-03-19	https://www.federalregister.gov/documents/full_text/xml/2002/03/19/02-6546.xml
Congressional Correspondence Tracking System (December 9, 2003, 68 FR 68606).	2006-06-05	https://www.federalregister.gov/documents/full_text/xml/2006/06/05/06-5088.xml
Employer Support of the Guard and Reserve Ombudsman and Outreach Programs.	2006-04-14	https://www.federalregister.gov/documents/full_text/xml/2006/04/14/06-3583.xml
EPA Central Data Exchange—Customer Registration Subsystem (CDX-CRS)	2002-03-18	https://www.federalregister.gov/documents/full_text/xml/2002/03/18/02-6486.xml
FRB-Employee Assistance Program Records.	2000-07-12	https://www.federalregister.gov/documents/full_text/xml/2000/07/12/00-17519.xml
Inmate Trust Fund Accounts and Commissary Record System. 	2002-03-15	https://www.federalregister.gov/documents/full_text/xml/2002/03/15/02-6203.xml
Defense Eligibility Records. 	2007-10-01	https://www.federalregister.gov/documents/full_text/xml/2007/10/01/E7-19321.xml
Patent Infringement and Litigation Records. 	2002-03-14	https://www.federalregister.gov/documents/full_text/xml/2002/03/14/02-6114.xml
Accounts Receivable, Indebtedness and Claims (February 22, 1993, 58 FR 10613).	2006-06-05	https://www.federalregister.gov/documents/full_text/xml/2006/06/05/06-5090.xml
Visitors' Log Records. 	2006-04-14	https://www.federalregister.gov/documents/full_text/xml/2006/04/14/E6-5541.xml
National Language Service Corps Pilot Records. 	2008-09-11	https://www.federalregister.gov/documents/full_text/xml/2008/09/11/E8-21106.xml
Absentee Case Files. 	2002-03-08	https://www.federalregister.gov/documents/full_text/xml/2002/03/08/02-5609.xml
Human Experimental and Research Data Records. 	2007-10-01	https://www.federalregister.gov/documents/full_text/xml/2007/10/01/E7-19267.xml
Drug-Free workplace Files.	2006-06-05	https://www.federalregister.gov/documents/full_text/xml/2006/06/05/06-5092.xml
Department of Justice Regional Data Exchange System (RDEX) 	2005-07-11	https://www.federalregister.gov/documents/full_text/xml/2005/07/11/05-13552.xml
Army Recruiting Prospect System. 	2008-09-11	https://www.federalregister.gov/documents/full_text/xml/2008/09/11/E8-21087.xml
	2002-02-27	https://www.federalregister.gov/documents/full_text/xml/2002/02/27/02-4613.xml
Occupational Radiation Information System. 	2007-10-01	https://www.federalregister.gov/documents/full_text/xml/2007/10/01/E7-19268.xml
Defense Biometric Identification System (DBIDS). 	2008-09-11	https://www.federalregister.gov/documents/full_text/xml/2008/09/11/E8-21104.xml
Student Information Files (February 22, 1993, 58 FR 10613).	2006-06-05	https://www.federalregister.gov/documents/full_text/xml/2006/06/05/06-5094.xml
Joint Medical Evacuation System (TRAC, 2, ES). 	2002-02-26	https://www.federalregister.gov/documents/full_text/xml/2002/02/26/02-4468.xml
Litigation and Disposition Documentation.	2006-06-05	https://www.federalregister.gov/documents/full_text/xml/2006/06/05/06-5095.xml
Department of Defense (DOD) Pentagon Building Pass File. 	2008-09-11	https://www.federalregister.gov/documents/full_text/xml/2008/09/11/E8-21108.xml
DLA Hometown News Releases.	2006-06-05	https://www.federalregister.gov/documents/full_text/xml/2006/06/05/06-5097.xml
Superfund Cost Recovery Accounting Information System. 	2002-02-22	https://www.federalregister.gov/documents/full_text/xml/2002/02/22/02-3921.xml
Human Research Protection Program (HRPP) Records. 	2008-09-11	https://www.federalregister.gov/documents/full_text/xml/2008/09/11/E8-21105.xml
Bond Management Information System.	2008-09-11	https://www.federalregister.gov/documents/full_text/xml/2008/09/11/E8-21075.xml
Official Personnel Files for Non-Appropriated Fund Employees (August 3, 1999, 64 FR 42101). 	2002-02-21	https://www.federalregister.gov/documents/full_text/xml/2002/02/21/02-4096.xml
Special Personnel Records. 	2007-10-01	https://www.federalregister.gov/documents/full_text/xml/2007/10/01/E7-19278.xml
U.S. Army Medical Department School and Academy of Health Sciences Academic Records.	2002-02-15	https://www.federalregister.gov/documents/full_text/xml/2002/02/15/02-3704.xml
Defense Outreach Referral System (DORS).	2006-06-05	https://www.federalregister.gov/documents/full_text/xml/2006/06/05/06-5099.xml
“Medicare Provider Analysis and Review (MEDPAR) HHS/CMS/OIS.” 	2006-04-06	https://www.federalregister.gov/documents/full_text/xml/2006/04/06/E6-4953.xml
Joint Duty Assignment Management Information System.	2006-06-05	https://www.federalregister.gov/documents/full_text/xml/2006/06/05/06-5101.xml
“Long Term Care-Minimum Data Set (LTCMDS),” Department of Health and Human Services (HHS)/Centers for Medicare & Medicaid Services (CMS)/Center for Medicaid and State Operations (CMSO). 	2002-02-13	https://www.federalregister.gov/documents/full_text/xml/2002/02/13/02-3451.xml
USAID Personnel Locator System. 	2008-09-10	https://www.federalregister.gov/documents/full_text/xml/2008/09/10/E8-20988.xml
Navy Morale, Welfare, and Recreation Debtors List. 	2006-06-05	https://www.federalregister.gov/documents/full_text/xml/2006/06/05/06-5096.xml
Family Advocacy Program Record. 	2002-02-12	https://www.federalregister.gov/documents/full_text/xml/2002/02/12/02-3321.xml
“Post-Acute Care Payment Reform / Continuity of Assessment Record and Evaluation Demonstration and Evaluation (PAC-CARE),” HHS/CMS/ORDI. 	2007-09-28	https://www.federalregister.gov/documents/full_text/xml/2007/09/28/E7-19110.xml
Compensation, Pension, Education and Rehabilitation Records. 	2008-09-02	https://www.federalregister.gov/documents/full_text/xml/2008/09/02/E8-20219.xml
Travel Manager System.	2002-02-07	https://www.federalregister.gov/documents/full_text/xml/2002/02/07/02-2995.xml
Regulatory Enforcement Record System. 	2008-09-02	https://www.federalregister.gov/documents/full_text/xml/2008/09/02/E8-20202.xml
Momentum Financials Open Obligations and Automated Disbursement Files	2002-01-30	https://www.federalregister.gov/documents/full_text/xml/2002/01/30/02-2240.xml
Radiation Exposure Records.	2002-01-30	https://www.federalregister.gov/documents/full_text/xml/2002/01/30/02-2175.xml
Day Care Facility Registrant, Applicant and Enrollee Records. 	2008-08-29	https://www.federalregister.gov/documents/full_text/xml/2008/08/29/E8-20058.xml
Military Equal Opportunity and Treatment.	2002-01-28	https://www.federalregister.gov/documents/full_text/xml/2002/01/28/02-1952.xml
The Standard Negotiable Instrument Processing System, T7901a.	2019-04-09	https://www.federalregister.gov/documents/full_text/xml/2019/04/09/2019-06941.xml
National Flood Insurance Community Rating System and Related Documents Files. 	2002-01-23	https://www.federalregister.gov/documents/full_text/xml/2002/01/23/02-1549.xml
Financial Management Systems.	2006-04-04	https://www.federalregister.gov/documents/full_text/xml/2006/04/04/06-3202.xml
Headquarters, United States Strategic Command (USSTRATCOM)/J8, Futures Capabilities Division, 901, SAC Blvd., Offutt AFB, NE 68113-6800 and Defense Advanced Research Projects Agency (DARPA), 3701 North Fairfax Drive, Arlington, VA 22203-1714.	2008-08-28	https://www.federalregister.gov/documents/full_text/xml/2008/08/28/E8-20005.xml
Army Disaster Personnel Accountability and Assessment Records (ADPAAS).	2008-08-28	https://www.federalregister.gov/documents/full_text/xml/2008/08/28/E8-20007.xml
Enrollment Database (EDB), HHS/CMS/CBC. 	2002-01-23	https://www.federalregister.gov/documents/full_text/xml/2002/01/23/02-1526.xml
Identity Management System (IDMS). 	2008-08-25	https://www.federalregister.gov/documents/full_text/xml/2008/08/25/E8-19590.xml
Employee Assistance Program Case Files. 	2003-06-26	https://www.federalregister.gov/documents/full_text/xml/2003/06/26/03-16132.xml
Common Working Files (CWF) System, HHS/CMS/OIS. 	2002-01-23	https://www.federalregister.gov/documents/full_text/xml/2002/01/23/02-1527.xml
Passport and Visa Files. 	2002-01-18	https://www.federalregister.gov/documents/full_text/xml/2002/01/18/02-1333.xml
Medical, Health, and Billing Records Systems, Health and Human Services/Indian Health Service/Office of Clinical and Preventive Services, (HHS/IHS/OCPS). 	2008-08-25	https://www.federalregister.gov/documents/full_text/xml/2008/08/25/E8-19481.xml
Unit Assigned Personnel Information. 	2002-01-18	https://www.federalregister.gov/documents/full_text/xml/2002/01/18/02-1332.xml
