Organization Locator and Personnel Roster System—FCA.	2009-08-04	https://www.federalregister.gov/documents/full_text/xml/2009/08/04/E9-18603.xml
Educational and Cultural Affairs Exchange Program Records, State-08.	2020-07-30	https://www.federalregister.gov/documents/full_text/xml/2020/07/30/2020-16567.xml
Anti-Harassment & Hostile Work Environment Case Tracking and Records System, 60-0380.	2020-07-27	https://www.federalregister.gov/documents/full_text/xml/2020/07/27/2020-16143.xml
Evaluation of Response to Intervention Practices for Elementary School Reading.	2013-05-09	https://www.federalregister.gov/documents/full_text/xml/2013/05/09/2013-11062.xml
COVID-19 Insights Collaboration Records, 09-90-2002.	2020-07-16	https://www.federalregister.gov/documents/full_text/xml/2020/07/16/2020-15380.xml
Individual Ready, Standby, and Retired Reserve Personnel Information System, A0600-8 AHRC.	2020-07-15	https://www.federalregister.gov/documents/full_text/xml/2020/07/15/2020-15268.xml
FCA-1—Employee Attendance, Leave, and Payroll Records—FCA., FCA-2—Financial Management Records—FCA., FCA-3—Property Accountability Records—FCA., FCA-4—Biographical Files—FCA., FCA-5—Assignments and Communication Tracking System—FCA., FCA-6—Freedom of Information and Privacy Act Requests—FCA., FCA-7—Inspector General Investigative Files—FCA., FCA-8—FCA internet Access System—FCA., FCA-9—Personnel Security Files—FCA., FCA-10—Farm Credit System Institution Criminal Referrals—FCA., FCA-11—Litigation and Administrative Adjudication Files—FCA., FCA-12—Health and Life Insurance Records—FCA., FCA-13—Correspondence Files—FCA., FCA-14—Employee Travel Records—FCA., FCA-15—Employee Training—FCA., FCA-16—Examiner Training and Education Records—FCA., FCA-17—Organization Locator and Personnel Roster System—FCA., FCA-18—Inspector General Investigative Files—FCA.	2020-05-26	https://www.federalregister.gov/documents/full_text/xml/2020/05/26/2020-11199.xml
DHS/FEMA-008 Disaster Recovery Assistance Files System of Records.	2013-04-30	https://www.federalregister.gov/documents/full_text/xml/2013/04/30/2013-10173.xml
FCA-10—Farm Credit System Institution Criminal Referrals—FCA.	2020-05-26	https://www.federalregister.gov/documents/full_text/xml/2020/05/26/2020-11198.xml
Delete entry and replace with: “DLA Telework Program Records”.	2006-05-05	https://www.federalregister.gov/documents/full_text/xml/2006/05/05/06-4250.xml
FCC/OMD-29, Motor Vehicle Management Program (MVMP).	2020-05-18	https://www.federalregister.gov/documents/full_text/xml/2020/05/18/2020-10533.xml
TechNet—SBA 38.	2013-04-22	https://www.federalregister.gov/documents/full_text/xml/2013/04/22/2013-09335.xml
Travel Authorization Files—Corporation-16.	2020-05-15	https://www.federalregister.gov/documents/full_text/xml/2020/05/15/2020-10477.xml
Join Senior Service Now Web-based Recruiting System (JASON)—Corporation-20.	2020-05-15	https://www.federalregister.gov/documents/full_text/xml/2020/05/15/2020-10478.xml
Department of the Treasury, Departmental Offices .311—TIGTA Office of Investigations Files.	2020-05-04	https://www.federalregister.gov/documents/full_text/xml/2020/05/04/2020-09435.xml
Air Force Personnel Accountability and Assessment System (AFPAAS) (May 6, 2009, 74 FR 20935).	2013-04-11	https://www.federalregister.gov/documents/full_text/xml/2013/04/11/2013-08436.xml
“Education Debt Reduction Program-VA” (115VA10).  	2020-04-24	https://www.federalregister.gov/documents/full_text/xml/2020/04/24/2020-08616.xml
Individuals Submitting Invoices-Vouchers for Payment and Accounting Transactional Data-VA 13VA047.	2020-04-23	https://www.federalregister.gov/documents/full_text/xml/2020/04/23/2020-08611.xml
Parties Involved in Patent Interference Proceedings.	2013-03-29	https://www.federalregister.gov/documents/full_text/xml/2013/03/29/2013-07340.xml
Bring Your Own Approved Device (BYOAD), F017 SAF CN A.	2020-04-09	https://www.federalregister.gov/documents/full_text/xml/2020/04/09/2020-07507.xml
Requestor Database for Office of the Secretary of Defense Mandatory Declassification Reviews, DWHS E05.	2020-04-02	https://www.federalregister.gov/documents/full_text/xml/2020/04/02/2020-06914.xml
Enterprise Mass Warning and Notification System (EMWNS), DCIO 02 DoD	2020-03-30	https://www.federalregister.gov/documents/full_text/xml/2020/03/30/2020-06526.xml
“Veterans Information Solution (VIS)—VA” (137VA005Q).	2009-07-28	https://www.federalregister.gov/documents/full_text/xml/2009/07/28/E9-17910.xml
DoD Personnel Accountability and Assessment System, DPR 39 DoD.	2020-03-26	https://www.federalregister.gov/documents/full_text/xml/2020/03/26/2020-06344.xml
Administrative Service Call System-FTC (FTC-VII-8).	2020-03-23	https://www.federalregister.gov/documents/full_text/xml/2020/03/23/2020-06071.xml
Centralized Disbursing System, T7320b.	2020-03-18	https://www.federalregister.gov/documents/full_text/xml/2020/03/18/2020-05665.xml
Separations: Administrative Board Proceedings.	2013-03-27	https://www.federalregister.gov/documents/full_text/xml/2013/03/27/2013-06964.xml
Defense Repository for Common Enterprise Data (DRCED), DUSDC 01.	2020-03-17	https://www.federalregister.gov/documents/full_text/xml/2020/03/17/2020-05504.xml
Department of Homeland Security (DHS)/ALL-043 Enterprise Biometric Administrative Records (EBAR) System of Records.	2020-03-16	https://www.federalregister.gov/documents/full_text/xml/2020/03/16/2020-04979.xml
Department of Homeland Security (DHS)/ALL-045 Statistical Immigration Data Production and Reporting.	2020-03-11	https://www.federalregister.gov/documents/full_text/xml/2020/03/11/2020-04978.xml
Office of Insular Affairs Programs.	2013-03-22	https://www.federalregister.gov/documents/full_text/xml/2013/03/22/2013-06579.xml
Department of Homeland Security (DHS)/U.S. Customs and Border Protection (CBP)-026 Explorer Program System of Records.	2020-03-11	https://www.federalregister.gov/documents/full_text/xml/2020/03/11/2020-04981.xml
Users of Public Facilities of the Patent and Trademark Office.	2013-03-19	https://www.federalregister.gov/documents/full_text/xml/2013/03/19/2013-06262.xml
FCA-1—Employee Attendance, Leave, and Payroll Records—FCA.	2020-03-10	https://www.federalregister.gov/documents/full_text/xml/2020/03/10/2020-04884.xml
Treasury/DO .216—Treasury Security Access Control and Certificates Systems.	2020-03-09	https://www.federalregister.gov/documents/full_text/xml/2020/03/09/2020-04669.xml
CFPB.028—Federal Docket Management System.	2020-02-28	https://www.federalregister.gov/documents/full_text/xml/2020/02/28/2020-02629.xml
“Veterans Affairs Department of Defense Identity Repository (VADIR)—VA” 138VA005Q.	2009-07-27	https://www.federalregister.gov/documents/full_text/xml/2009/07/27/E9-17776.xml
Trademark Application and Registration Records, COMMERCE/USPTO-26.	2020-02-18	https://www.federalregister.gov/documents/full_text/xml/2020/02/18/2020-03068.xml
Lacey Act Declaration Information System (LADIS), USDA/APHIS-24.	2020-02-14	https://www.federalregister.gov/documents/full_text/xml/2020/02/14/2020-03007.xml
The FAFSA Completion Study.	2013-03-15	https://www.federalregister.gov/documents/full_text/xml/2013/03/15/2013-06073.xml
Veterans Canteen Service (VCS) Payroll Deduction Program (PDP), Point of Sale (POS) Help Desk and eCommerce—VA (117VA10NA6)	2020-02-07	https://www.federalregister.gov/documents/full_text/xml/2020/02/07/2020-02480.xml
Automated Payroll Cost and Personnel System (APCAPS).	2009-07-20	https://www.federalregister.gov/documents/full_text/xml/2009/07/20/E9-17152.xml
Security Assistance Network (SAN), DSCA 07.	2020-01-16	https://www.federalregister.gov/documents/full_text/xml/2020/01/16/2020-00587.xml
DHS/CBP-018 Customs—Trade Partnership Against Terrorism (C-TPAT) 	2013-03-13	https://www.federalregister.gov/documents/full_text/xml/2013/03/13/2013-05674.xml
CNCS-03-OIG, -, Investigative Files.	2020-01-16	https://www.federalregister.gov/documents/full_text/xml/2020/01/16/2020-00581.xml
Forms and Account Management Service (FAMS), DCFO-01.	2020-01-14	https://www.federalregister.gov/documents/full_text/xml/2020/01/14/2020-00365.xml
Department of the Treasury—.018 E-Rulemaking.	2020-01-09	https://www.federalregister.gov/documents/full_text/xml/2020/01/09/2020-00145.xml
DOT/FMCSA 006, SAFETYNET.	2019-12-30	https://www.federalregister.gov/documents/full_text/xml/2019/12/30/2019-28099.xml
BGFRS-23, “FRB—Freedom of Information Act and Privacy Act Case Tracking and Reporting System.”	2019-12-27	https://www.federalregister.gov/documents/full_text/xml/2019/12/27/2019-27866.xml
Navy Disaster Accounting and Assessment System (DAAS).	2006-05-05	https://www.federalregister.gov/documents/full_text/xml/2006/05/05/06-4251.xml
NLRB FOIAonline. NLRB-35	2019-12-12	https://www.federalregister.gov/documents/full_text/xml/2019/12/12/2019-26754.xml
Freedom of Information Act Tracking System (FTS) and Associated Agency Files. NLRB-32.	2019-12-12	https://www.federalregister.gov/documents/full_text/xml/2019/12/12/2019-26755.xml
Audit Trail and Security Records—Treasury/IRS 34.037.	2013-03-11	https://www.federalregister.gov/documents/full_text/xml/2013/03/11/2013-05513.xml
Defense Institute of Security Assistance Management (DISAM) Information System Mission (DISM), DSCA 05.	2019-11-21	https://www.federalregister.gov/documents/full_text/xml/2019/11/21/2019-25203.xml
Integrated Management Administrative Resources Tool System (iMART). USDA/FAS-9.	2019-11-19	https://www.federalregister.gov/documents/full_text/xml/2019/11/19/2019-25020.xml
DOJ Identity, Credential, and Access Service Records System, JUSTICE/DOJ-020.	2019-11-07	https://www.federalregister.gov/documents/full_text/xml/2019/11/07/2019-24246.xml
Federal Student Aid Application File (18-11-01).	2019-10-29	https://www.federalregister.gov/documents/full_text/xml/2019/10/29/2019-23581.xml
Department of Labor Federal Docket Management System (DOLFDMS), DOL/CENTRAL-8.	2019-10-25	https://www.federalregister.gov/documents/full_text/xml/2019/10/25/2019-22922.xml
EPA Science Advisory Board (SAB) Database of Scientific and Technical Experts.	2009-07-13	https://www.federalregister.gov/documents/full_text/xml/2009/07/13/E9-16493.xml
Personnel Accountability System—Not Covered by Notices of Other Agencies.	2019-10-25	https://www.federalregister.gov/documents/full_text/xml/2019/10/25/2019-23387.xml
Criminal Investigation and Crime Laboratory Files , (July 7, 1997, 62 FR 36267).	2000-05-15	https://www.federalregister.gov/documents/full_text/xml/2000/05/15/00-12071.xml
DOT/FMCSA 010—Commercial Driver's License Drug and Alcohol Clearinghouse (Clearinghouse).	2019-10-22	https://www.federalregister.gov/documents/full_text/xml/2019/10/22/2019-22915.xml
Disability Retirement Records (June 11, 1997, 62 FR 31793).	2013-03-05	https://www.federalregister.gov/documents/full_text/xml/2013/03/05/2013-05053.xml
Department of the Treasury, Office of the Comptroller of the Currency (OCC) Treasury/OCC .220. Processing, Tracking and Recordkeeping System: 914 and other Background Checks.	2019-10-18	https://www.federalregister.gov/documents/full_text/xml/2019/10/18/2019-22408.xml
Defense Joint Military Pay System-Active Component (March 21, 2006, 71 FR 14179).	2013-03-05	https://www.federalregister.gov/documents/full_text/xml/2013/03/05/2013-05050.xml
Claims Received and Adjudicated by the Foreign Claims Settlement Commission JUSTICE/FCSC-33.	2019-10-17	https://www.federalregister.gov/documents/full_text/xml/2019/10/17/2019-22496.xml
Systems Acquisition Schools Student Records (June 11, 1997, 62 FR 31793)	2009-07-10	https://www.federalregister.gov/documents/full_text/xml/2009/07/10/E9-16374.xml
FCSC-9, Czechoslovakia, Claims Against (2nd Program), FCSC-11, Federal Republic of Germany, Questionnaire Inquiries From, FCSC-12, Hungary, Claims Against (2nd Program), FCSC-14, Micronesia, Claims Arising in, FCSC-16, Prisoners of War (Pueblo), FCSC-21, German Democratic Republic, Claims Against, FCSC-23, Vietnam, Claims for Losses Against, FCSC-24, Ethiopia, Claims for Losses Against	2019-10-16	https://www.federalregister.gov/documents/full_text/xml/2019/10/16/2019-22498.xml
Safety, Health, Injury, and Accident Records (February 5, 2010; 75 FR 5997)	2013-03-05	https://www.federalregister.gov/documents/full_text/xml/2013/03/05/2013-05054.xml
FCSC-10, East Germany, Registration of Claims Against	2019-10-16	https://www.federalregister.gov/documents/full_text/xml/2019/10/16/2019-22500.xml
Private Relief Legislation (April 1, 2008, 73 FR 17331).	2013-03-05	https://www.federalregister.gov/documents/full_text/xml/2013/03/05/2013-05059.xml
Aeromedical Research Data (11 June 1997, 62 FR 31793).	2009-07-10	https://www.federalregister.gov/documents/full_text/xml/2009/07/10/E9-16323.xml
Deployable Disbursing System (DDS) (June 4, 2007, 72 FR 30785).	2013-03-05	https://www.federalregister.gov/documents/full_text/xml/2013/03/05/2013-05028.xml
Defense Enrollment Eligibility Reporting Systems (DEERS), DMDC 02 DoD.	2019-10-16	https://www.federalregister.gov/documents/full_text/xml/2019/10/16/2019-22556.xml
RESOLVE Program Records. 	2006-04-26	https://www.federalregister.gov/documents/full_text/xml/2006/04/26/E6-6232.xml
Enterprise Support Portal (ESP).	2013-03-05	https://www.federalregister.gov/documents/full_text/xml/2013/03/05/2013-05047.xml
DCAA Management Information System (DMIS) (November 9, 2005, 70 FR 67995).	2013-03-05	https://www.federalregister.gov/documents/full_text/xml/2013/03/05/2013-05045.xml
Joint Advertising, Market Research & Studies (JAMRS) Recruiting Database, DHRA 04.	2019-10-16	https://www.federalregister.gov/documents/full_text/xml/2019/10/16/2019-22562.xml
Defense Business Management System (DBMS).	2009-07-02	https://www.federalregister.gov/documents/full_text/xml/2009/07/02/E9-15631.xml
FCC/WCB-2, Toll Free Number Auction System.	2019-10-11	https://www.federalregister.gov/documents/full_text/xml/2019/10/11/2019-22258.xml
14(c) Certificate Application Processing System	2019-10-11	https://www.federalregister.gov/documents/full_text/xml/2019/10/11/2019-22231.xml
Deliberate and Crisis Action Planning and Execution Segment (DCAPES) Records (July 2, 2009, 74 FR 31721)	2013-03-05	https://www.federalregister.gov/documents/full_text/xml/2013/03/05/2013-05032.xml
Admissions Records (July 7, 2008, 73 FR 38409).	2009-07-02	https://www.federalregister.gov/documents/full_text/xml/2009/07/02/E9-15627.xml
Absentee and Deserter Information Files (June 11, 1997, 62 FR 31793).	2013-03-05	https://www.federalregister.gov/documents/full_text/xml/2013/03/05/2013-05031.xml
Department of Homeland Security (DHS)/U.S. Citizenship and Immigration Services (USCIS)-007 Benefits Information System.	2019-10-10	https://www.federalregister.gov/documents/full_text/xml/2019/10/10/2019-22156.xml
DHS/ALL Personal Identity Verification Management System (PIVMS). 	2009-06-25	https://www.federalregister.gov/documents/full_text/xml/2009/06/25/E9-14905.xml
Telework Application and Agreement Records.	2013-03-04	https://www.federalregister.gov/documents/full_text/xml/2013/03/04/2013-04927.xml
The Next Generation Identification (NGI) System, JUSTICE/FBI-009.	2019-10-09	https://www.federalregister.gov/documents/full_text/xml/2019/10/09/2019-21585.xml
National Instant Criminal Background Check System (NICS), JUSTICE/FBI-018	2019-10-09	https://www.federalregister.gov/documents/full_text/xml/2019/10/09/2019-21583.xml
“Principles of Excellence Centralized Complaint System-VA” 170VA22.	2013-02-22	https://www.federalregister.gov/documents/full_text/xml/2013/02/22/2013-04114.xml
Forms and Account Management Service (FAMS), F065 SAF FMF A	2019-10-09	https://www.federalregister.gov/documents/full_text/xml/2019/10/09/2019-22037.xml
System for Award Management (SAM).	2013-02-19	https://www.federalregister.gov/documents/full_text/xml/2013/02/19/2013-03743.xml
Compensation, Pension, Education, and Vocational Rehabilitation and Employment Records—VA.	2009-06-19	https://www.federalregister.gov/documents/full_text/xml/2009/06/19/E9-14302.xml
Defense Sexual Assault Incident Database (DSAID), DHRA 06 DoD.	2019-10-09	https://www.federalregister.gov/documents/full_text/xml/2019/10/09/2019-22078.xml
Financial Management System—Delphi.	2019-10-08	https://www.federalregister.gov/documents/full_text/xml/2019/10/08/2019-21925.xml
Alien Criminal Response Information Management (ACRIMe). 	2013-02-14	https://www.federalregister.gov/documents/full_text/xml/2013/02/14/2013-03377.xml
Defense Debt Collection Data Base , (May 11, 1999, 64 FR 25310)., Reason: These records have been transferred to the Defense Finance and Accounting Service and are now being maintained under Privacy Act system of records T7332, Defense Debt Management System. 	2000-05-15	https://www.federalregister.gov/documents/full_text/xml/2000/05/15/00-12070.xml
Defense Logistics Agency Criminal Incident Reporting System Records.	2009-06-08	https://www.federalregister.gov/documents/full_text/xml/2009/06/08/E9-13270.xml
Public Safety Officers' Benefits System, JUSTICE/OJP-012.	2019-10-08	https://www.federalregister.gov/documents/full_text/xml/2019/10/08/2019-21584.xml
“Long Term Care Hospitals Quality Reporting Program (LTCH QRP)” HHS/CMS/CCSQ.	2013-02-06	https://www.federalregister.gov/documents/full_text/xml/2013/02/06/2013-02669.xml
Efforts to Outcome Case Management Tracking System for DHAP-Ike.	2013-02-06	https://www.federalregister.gov/documents/full_text/xml/2013/02/06/2013-02672.xml
Retiree Drug Subsidy (RDS), HHS/CMS/CM, System No. 09-70-0550.	2019-10-08	https://www.federalregister.gov/documents/full_text/xml/2019/10/08/2019-21768.xml
NSA/CSS Travel Records.	2009-06-08	https://www.federalregister.gov/documents/full_text/xml/2009/06/08/E9-13264.xml
GSA/OGP-1, e-Rulemaking Program Administrative System.	2019-10-08	https://www.federalregister.gov/documents/full_text/xml/2019/10/08/2019-21885.xml
Health Insurance Exchanges (HIX) Program, HHS/CMS/CCIIO	2013-02-06	https://www.federalregister.gov/documents/full_text/xml/2013/02/06/2013-02666.xml
Department of Transportation Federal Motor Carrier Safety Administration DOT/FMCSA 009—National Registry of Certified Medical Examiners (National Registry)	2019-10-04	https://www.federalregister.gov/documents/full_text/xml/2019/10/04/2019-21412.xml
DHS/ICE-010 Confidential and Other Sources of Information (COSI)	2013-02-04	https://www.federalregister.gov/documents/full_text/xml/2013/02/04/2013-02343.xml
NSA/CSS Payroll Processing File.	2009-06-08	https://www.federalregister.gov/documents/full_text/xml/2009/06/08/E9-13265.xml
Presidential Cybersecurity Education Award (18-15-01).	2019-10-03	https://www.federalregister.gov/documents/full_text/xml/2019/10/03/2019-21532.xml
INTERIOR/DOI-20, Paleontological Resources Preservation System.	2019-10-02	https://www.federalregister.gov/documents/full_text/xml/2019/10/02/2019-21378.xml
Debt Collection Operations System—Treasury/Financial Management Service.	2009-06-04	https://www.federalregister.gov/documents/full_text/xml/2009/06/04/E9-13073.xml
Financial Management System—Delphi.	2019-10-02	https://www.federalregister.gov/documents/full_text/xml/2019/10/02/2019-21342.xml
CFPB.027—Emergency Notification System.	2019-10-01	https://www.federalregister.gov/documents/full_text/xml/2019/10/01/2019-20724.xml
INTERIOR/Reclamation-14, Land and Realty Program.	2019-09-30	https://www.federalregister.gov/documents/full_text/xml/2019/09/30/2019-21072.xml
Immigration and Enforcement Operational Records (ENFORCE).	2015-04-30	https://www.federalregister.gov/documents/full_text/xml/2015/04/30/2015-09615.xml
Veteran Programs Training and Counseling Records (SBA 39).	2019-09-25	https://www.federalregister.gov/documents/full_text/xml/2019/09/25/2019-20687.xml
Electronic Research Administration (eRA) Records, HHS/NIH/OD/OER, 09-25-0225.	2019-09-20	https://www.federalregister.gov/documents/full_text/xml/2019/09/20/2019-20423.xml
Military Pay Correction Case Files (September 16, 1998, 63 FR 49554).	2013-01-29	https://www.federalregister.gov/documents/full_text/xml/2013/01/29/2013-01792.xml
OPM Child Care Tuition Assistance Records. 	2000-05-12	https://www.federalregister.gov/documents/full_text/xml/2000/05/12/00-12054.xml
Veteran Programs Training and Counseling Records (SBA 39).	2019-09-12	https://www.federalregister.gov/documents/full_text/xml/2019/09/12/2019-19686.xml
HUD/OCIO-002 Enterprise Data Management (EDM).	2019-09-12	https://www.federalregister.gov/documents/full_text/xml/2019/09/12/2019-19713.xml
National Crime Information Center (NCIC), JUSTICE/FBI-001.	2019-09-10	https://www.federalregister.gov/documents/full_text/xml/2019/09/10/2019-19449.xml
Patient Advocate Tracking System (PATS)-VA. 	2009-06-03	https://www.federalregister.gov/documents/full_text/xml/2009/06/03/E9-12954.xml
National Student Loan Data System (NSLDS) (18-11-06).	2019-09-09	https://www.federalregister.gov/documents/full_text/xml/2019/09/09/2019-19354.xml
OGE/GOVT-2, Executive Branch Confidential Financial Disclosure Reports.	2019-09-09	https://www.federalregister.gov/documents/full_text/xml/2019/09/09/2019-19373.xml
“Veterans Crisis Line Database-VA”.	2015-04-24	https://www.federalregister.gov/documents/full_text/xml/2015/04/24/2015-09567.xml
Defense Civilian Personnel Data System.	2006-04-21	https://www.federalregister.gov/documents/full_text/xml/2006/04/21/06-3803.xml
OGE/GOVT-1, Executive Branch Personnel Public Financial Disclosure Reports and Other Name-Retrieved Ethics Program Records.	2019-09-09	https://www.federalregister.gov/documents/full_text/xml/2019/09/09/2019-19372.xml
Small Business Investment Company Information System (SBICIS), # 40.	2019-09-05	https://www.federalregister.gov/documents/full_text/xml/2019/09/05/2019-19153.xml
Department of Transportation (DOT)/Federal Motor Carrier Safety Administration (FMCSA) 010, Military Under 21 Pilot Program System of Records.	2019-09-05	https://www.federalregister.gov/documents/full_text/xml/2019/09/05/2019-19135.xml
Mailing and Other Lists	2015-04-20	https://www.federalregister.gov/documents/full_text/xml/2015/04/20/2015-08999.xml
BGFRS-38 “FRB—Transportation Subsidy Records”	2019-09-03	https://www.federalregister.gov/documents/full_text/xml/2019/09/03/2019-18890.xml
Organized Crime Drug Enforcement Task Force Fusion Center and International Organized Crime Intelligence and Operations Center System.	2009-06-03	https://www.federalregister.gov/documents/full_text/xml/2009/06/03/E9-12860.xml
Defense Occupational & Environmental Health Readiness System—Industrial Hygiene (DOEHRS-IH) (August 26, 2010, 75 FR 52513).	2013-01-28	https://www.federalregister.gov/documents/full_text/xml/2013/01/28/2013-01694.xml
CNCS-01-OGC-Office of General Counsel (OGC) Legal Files.	2019-09-03	https://www.federalregister.gov/documents/full_text/xml/2019/09/03/2019-18918.xml
INTERIOR/OS-02, Individual Indian Money (IIM) Trust Funds.	2019-08-23	https://www.federalregister.gov/documents/full_text/xml/2019/08/23/2019-18184.xml
FRTIB-21, Identity, Credential and Access Management (ICAM).	2019-08-21	https://www.federalregister.gov/documents/full_text/xml/2019/08/21/2019-18034.xml
Section 608 Technician Certification Records, EPA-75.	2019-08-20	https://www.federalregister.gov/documents/full_text/xml/2019/08/20/2019-17922.xml
Law Office Management System	2009-05-29	https://www.federalregister.gov/documents/full_text/xml/2009/05/29/E9-12502.xml
EOIR-002, Office of the Chief Administrative Hearing Officer (OCAHO) Case Management System (CMS).	2019-08-16	https://www.federalregister.gov/documents/full_text/xml/2019/08/16/2019-17364.xml
Medical Readiness Reporting System (MRRS) (May 5, 2006, 71 FR 26481).	2013-01-28	https://www.federalregister.gov/documents/full_text/xml/2013/01/28/2013-01682.xml
Common Origination and Disbursement (COD) System (18-11-02).	2019-08-16	https://www.federalregister.gov/documents/full_text/xml/2019/08/16/2019-17615.xml
Agricultural Quarantine Activity System (AQAS), USDA/APHIS-20.	2019-08-14	https://www.federalregister.gov/documents/full_text/xml/2019/08/14/2019-17461.xml
Defense Working Capital Fund Accounting System (August 13, 2007, 72 FR 45231).	2013-01-28	https://www.federalregister.gov/documents/full_text/xml/2013/01/28/2013-01685.xml
Federal Docket Management System (FDMS), EPA-71.	2019-08-14	https://www.federalregister.gov/documents/full_text/xml/2019/08/14/2019-17459.xml
Travel System	2009-05-28	https://www.federalregister.gov/documents/full_text/xml/2009/05/28/E9-12372.xml
Fulbright-Hays—Doctoral Dissertation Research Abroad (DDRA) and Seminars Abroad (SA) (18-12-02).	2019-08-13	https://www.federalregister.gov/documents/full_text/xml/2019/08/13/2019-17324.xml
Regional Center Persons/Activity Management System (RCPAMS).	2013-01-28	https://www.federalregister.gov/documents/full_text/xml/2013/01/28/2013-01680.xml
Freedom of Information Act Case Files (December 8, 2010, 75 FR 76432).	2013-01-28	https://www.federalregister.gov/documents/full_text/xml/2013/01/28/2013-01689.xml
Online Criminal Enforcement Activities Network (OCEAN).	2019-08-02	https://www.federalregister.gov/documents/full_text/xml/2019/08/02/2019-16565.xml
Army Housing Operations Management System (HOMS).	2006-04-21	https://www.federalregister.gov/documents/full_text/xml/2006/04/21/06-3805.xml
Public Affairs Subscription Mailing Lists.	2009-05-26	https://www.federalregister.gov/documents/full_text/xml/2009/05/26/E9-12040.xml
Telecommunications Notification System (July 6, 2010, 75 FR 38792).	2013-01-28	https://www.federalregister.gov/documents/full_text/xml/2013/01/28/2013-01681.xml
BGFRS-12 “FRB—Bank Officers Personnel System”	2019-07-30	https://www.federalregister.gov/documents/full_text/xml/2019/07/30/2019-16153.xml
C.W. Bill Young Cell Transplantation Program.	2009-05-21	https://www.federalregister.gov/documents/full_text/xml/2009/05/21/E9-11946.xml
