Department of Transportation (DOT)/ALL—25, Biographies System of Records	2013-05-08	https://www.federalregister.gov/documents/full_text/xml/2013/05/08/2013-10842.xml
Integrated Automated Travel System (IATS).	2010-04-23	https://www.federalregister.gov/documents/full_text/xml/2010/04/23/2010-9386.xml
Human Capital Learning and Performance Improvement System (HCL&PIS).	2004-04-12	https://www.federalregister.gov/documents/full_text/xml/2004/04/12/04-8237.xml
Soldiers' Criminal History Files	2013-05-07	https://www.federalregister.gov/documents/full_text/xml/2013/05/07/2013-10769.xml
Department of Defense Education Activity Non-DoD Schools Program.	2011-10-05	https://www.federalregister.gov/documents/full_text/xml/2011/10/05/2011-25550.xml
Mentoring Program. 	2008-03-17	https://www.federalregister.gov/documents/full_text/xml/2008/03/17/E8-5308.xml
NSA Police Operational Files.	2010-04-23	https://www.federalregister.gov/documents/full_text/xml/2010/04/23/2010-9393.xml
Installation Support Modules Records	2010-04-23	https://www.federalregister.gov/documents/full_text/xml/2010/04/23/2010-9392.xml
Official Records for Host Enrollee Programs (November 16, 2004; 69 FR 67112).	2010-04-20	https://www.federalregister.gov/documents/full_text/xml/2010/04/20/2010-9004.xml
Defense Disbursing Analysis Reporting System (DDARS). 	2008-03-17	https://www.federalregister.gov/documents/full_text/xml/2008/03/17/E8-5306.xml
Standard Installation/Division Personnel System (SIDPERS).	2013-05-03	https://www.federalregister.gov/documents/full_text/xml/2013/05/03/2013-10534.xml
DLA Vehicle/Equipment Operator Files.	2010-04-20	https://www.federalregister.gov/documents/full_text/xml/2010/04/20/2010-9000.xml
Patient Medical Records-VA. 	2004-04-07	https://www.federalregister.gov/documents/full_text/xml/2004/04/07/04-7819.xml
TIGTA Office of Investigations Files. 	2010-04-20	https://www.federalregister.gov/documents/full_text/xml/2010/04/20/2010-8926.xml
Agency Management Information System/Grants (AMIS/GRANTS and CONTRACTS), HHA/AHRQ/OPART. The “Agency Management Information System/Grants and Contracts (AMIS/GRANTS and CONTRACTS), HHS/AHRQ/OM” was previously named the “Agency for Healthcare Research and Quality, Grants Information and Tracking System with Contracts Component (GIAnT), HHS/AHRQ/OM”.	2004-04-05	https://www.federalregister.gov/documents/full_text/xml/2004/04/05/04-7653.xml
Close Call Confidentiality Reporting System (C³RS).	2010-04-19	https://www.federalregister.gov/documents/full_text/xml/2010/04/19/2010-8908.xml
Marine Corps Official Military Personnel Files. 	2008-03-17	https://www.federalregister.gov/documents/full_text/xml/2008/03/17/E8-5349.xml
C.W. Bill Young Cell Transplantation Program. 	2008-03-13	https://www.federalregister.gov/documents/full_text/xml/2008/03/13/E8-5056.xml
Volunteer/Trainee Sexual Misconduct Complaint Files.	2013-05-01	https://www.federalregister.gov/documents/full_text/xml/2013/05/01/2013-10225.xml
Student Aid Internet Gateway (SAIG), Participation Management System.	2010-04-19	https://www.federalregister.gov/documents/full_text/xml/2010/04/19/2010-8959.xml
Inquiry Routing & Information System (IRIS)—VA. 	2008-03-12	https://www.federalregister.gov/documents/full_text/xml/2008/03/12/E8-4895.xml
Chief Counsel Human Resources and Administrative Records—Treasury/IRS.	2012-08-10	https://www.federalregister.gov/documents/full_text/xml/2012/08/10/2012-19325.xml
Personnel Security and Suitability Investigations Records.	2013-05-01	https://www.federalregister.gov/documents/full_text/xml/2013/05/01/2013-09105.xml
Confidential Financial Disclosure Report.	2010-04-16	https://www.federalregister.gov/documents/full_text/xml/2010/04/16/2010-8738.xml
Medicare Savings Programs Information System, Social Security Administration, Office of Income Security Programs.	2004-03-31	https://www.federalregister.gov/documents/full_text/xml/2004/03/31/04-7069.xml
Judicial and Administrative Filings Collection. 	2013-05-01	https://www.federalregister.gov/documents/full_text/xml/2013/05/01/2013-10206.xml
Recall Rosters.	2010-04-16	https://www.federalregister.gov/documents/full_text/xml/2010/04/16/2010-8740.xml
The Revenue Program—Billing and Collections Records—VA. 	2008-03-12	https://www.federalregister.gov/documents/full_text/xml/2008/03/12/E8-4896.xml
CFPB Advisory Boards and Committees	2013-05-01	https://www.federalregister.gov/documents/full_text/xml/2013/05/01/2013-10204.xml
Personnel Roster/Locator Files (December 26, 2002; 67 FR 78780).	2010-04-15	https://www.federalregister.gov/documents/full_text/xml/2010/04/15/2010-8656.xml
Official Records for Host Enrollee Programs (November 16, 2004; 69 FR 67112).	2010-04-15	https://www.federalregister.gov/documents/full_text/xml/2010/04/15/2010-8655.xml
Chief Counsel Correspondence Control and Records, Associate Chief Counsel (Technical and International)—Treasury/IRS.	2008-03-12	https://www.federalregister.gov/documents/full_text/xml/2008/03/12/E8-4430.xml
International Affairs Personnel Initiatives Database.	2010-04-15	https://www.federalregister.gov/documents/full_text/xml/2010/04/15/2010-8653.xml
Defense Eligibility Records.	2004-03-24	https://www.federalregister.gov/documents/full_text/xml/2004/03/24/04-6492.xml
Telecommunications System.	2012-08-09	https://www.federalregister.gov/documents/full_text/xml/2012/08/09/2012-19572.xml
Master Representative Payee File, Social Security Administration (SSA)	2013-04-22	https://www.federalregister.gov/documents/full_text/xml/2013/04/22/2013-09343.xml
Criminal Law Enforcement Records System 	2013-04-18	https://www.federalregister.gov/documents/full_text/xml/2013/04/18/2013-09103.xml
Alternate Worksite Records.	2010-04-15	https://www.federalregister.gov/documents/full_text/xml/2010/04/15/2010-8654.xml
Freedom of Information Act File. 	2008-03-10	https://www.federalregister.gov/documents/full_text/xml/2008/03/10/E8-4714.xml
Health Claims Data Warehouse (HCDW).	2013-04-18	https://www.federalregister.gov/documents/full_text/xml/2013/04/18/2013-09133.xml
Standardized Student Records System.	2011-10-05	https://www.federalregister.gov/documents/full_text/xml/2011/10/05/2011-25548.xml
DTRA Telework Program Records. 	2008-03-10	https://www.federalregister.gov/documents/full_text/xml/2008/03/10/E8-4712.xml
DLA Hometown News Releases (June 24, 2011; 76 FR 37082).	2013-04-17	https://www.federalregister.gov/documents/full_text/xml/2013/04/17/2013-08917.xml
DHS/USCIS-006 Fraud Detection and National Security Records. 	2012-08-08	https://www.federalregister.gov/documents/full_text/xml/2012/08/08/2012-19337.xml
Navy Military Personnel Records System.	2010-04-15	https://www.federalregister.gov/documents/full_text/xml/2010/04/15/2010-8652.xml
Indebtedness, Nonsupport Paternity (June 11, 1997, 62 FR 31793).	2013-03-05	https://www.federalregister.gov/documents/full_text/xml/2013/03/05/2013-05035.xml
State-Provided Physician Records for the Application Submission & Processing System, OSD, BHPr, HRSA.	2010-04-15	https://www.federalregister.gov/documents/full_text/xml/2010/04/15/2010-8620.xml
Navy Fleet and Family Readiness (F&FR) Internship Program 	2008-03-10	https://www.federalregister.gov/documents/full_text/xml/2008/03/10/E8-4728.xml
[CHANGE TO READ:], Employee Inquiry, Complaint, and Investigative Records, 070.040	2004-03-23	https://www.federalregister.gov/documents/full_text/xml/2004/03/23/04-6399.xml
Defense Logistics Agency (DLA) Criminal Incident Reporting System Records (DCIRS).	2010-04-14	https://www.federalregister.gov/documents/full_text/xml/2010/04/14/2010-8506.xml
Vietnamese Commando Compensation Files (November 30, 1998, 63 FR 65760).	2013-04-16	https://www.federalregister.gov/documents/full_text/xml/2013/04/16/2013-08896.xml
Joint Employment Management System (JEMS). 	2008-03-10	https://www.federalregister.gov/documents/full_text/xml/2008/03/10/E8-4734.xml
DHS/U.S. Citizenship and Immigration Services—011—E-Verify Program 	2012-08-08	https://www.federalregister.gov/documents/full_text/xml/2012/08/08/2012-19204.xml
Citizenship and Immigration Services Ombudsman—001 Virtual Ombudsman System of Records.	2010-04-13	https://www.federalregister.gov/documents/full_text/xml/2010/04/13/2010-8313.xml
National Financial Literacy Challenge—Treasury/DO. 	2008-03-10	https://www.federalregister.gov/documents/full_text/xml/2008/03/10/E8-4629.xml
Investigations and Complaints (June 2, 2010, 75 FR 30791).	2013-04-16	https://www.federalregister.gov/documents/full_text/xml/2013/04/16/2013-08895.xml
Transportation Security Administration 013 Federal Flight Deck Officer Record System (FFDORS).	2010-04-13	https://www.federalregister.gov/documents/full_text/xml/2010/04/13/2010-8317.xml
Employee Transportation Facilitation. 	2004-03-16	https://www.federalregister.gov/documents/full_text/xml/2004/03/16/04-5846.xml
Department of Homeland Security (DHS)/U.S. Citizenship and Immigration Services (USCIS), Systematic Alien Verification for Entitlements (SAVE).	2012-08-08	https://www.federalregister.gov/documents/full_text/xml/2012/08/08/2012-19207.xml
Transportation Security Administration 011 Transportation Security Intelligence Service (TSIS) Operations Files.	2010-04-13	https://www.federalregister.gov/documents/full_text/xml/2010/04/13/2010-8315.xml
Delete entry and replace with “Special Program Information Systems.” 	2008-03-06	https://www.federalregister.gov/documents/full_text/xml/2008/03/06/E8-4365.xml
Complaint Files and Log. 	2004-03-15	https://www.federalregister.gov/documents/full_text/xml/2004/03/15/04-5675.xml
Occupational, Safety, Health, and Environmental Management Records (July 2, 2010, 75 FR 38494).	2013-04-16	https://www.federalregister.gov/documents/full_text/xml/2013/04/16/2013-08899.xml
Human Resources Management System (HRMS). 	2008-03-06	https://www.federalregister.gov/documents/full_text/xml/2008/03/06/E8-4370.xml
Biometric Verification System.	2013-04-16	https://www.federalregister.gov/documents/full_text/xml/2013/04/16/2013-08884.xml
Transportation Security Administration 006 Correspondence and Matters Tracking Records (CMTR).	2010-04-13	https://www.federalregister.gov/documents/full_text/xml/2010/04/13/2010-8316.xml
Electronic Police Operations Command Reporting System (EPOCRS)—Treasury/BEP.	2013-04-16	https://www.federalregister.gov/documents/full_text/xml/2013/04/16/2013-08849.xml
Mail Management and Tracking Activity.	2012-08-03	https://www.federalregister.gov/documents/full_text/xml/2012/08/03/2012-18957.xml
“Program Information Management System” (PIMS) (09-90-0052) HHS/OS/OCR.	2010-04-13	https://www.federalregister.gov/documents/full_text/xml/2010/04/13/2010-8412.xml
Special Program Information Systems.	2008-03-06	https://www.federalregister.gov/documents/full_text/xml/2008/03/06/E8-4373.xml
Kiosk System.	2013-04-16	https://www.federalregister.gov/documents/full_text/xml/2013/04/16/2013-08885.xml
“Minority Health Information Service,” HHS/OS/OPHS/OMH.	2010-04-13	https://www.federalregister.gov/documents/full_text/xml/2010/04/13/2010-8413.xml
Post Office and Retail Services.	2011-10-05	https://www.federalregister.gov/documents/full_text/xml/2011/10/05/2011-25735.xml
POW/MIA Intelligence Analysis and Debrief Files. 	2008-03-04	https://www.federalregister.gov/documents/full_text/xml/2008/03/04/E8-4086.xml
Combat-Related Special Compensation Branch Files.	2004-03-05	https://www.federalregister.gov/documents/full_text/xml/2004/03/05/04-4891.xml
“Medicaid Integrity Program System (MIPS),” HHS/CMS/CMSO. 	2008-03-04	https://www.federalregister.gov/documents/full_text/xml/2008/03/04/E8-4069.xml
Internal Electronic Collaboration Tools.	2012-08-03	https://www.federalregister.gov/documents/full_text/xml/2012/08/03/2012-19006.xml
Passport, Visa, and Country Clearance Files (July 23, 2003; 68 FR 43504).	2010-04-08	https://www.federalregister.gov/documents/full_text/xml/2010/04/08/2010-7991.xml
“Links To Social Security Administration and Centers For Medicare & Medicaid Services Data (LOD),” HHS/CMS/ORDI 	2008-03-04	https://www.federalregister.gov/documents/full_text/xml/2008/03/04/E8-4070.xml
Office of the Secretary of Defense Identification Badge System.	2010-04-08	https://www.federalregister.gov/documents/full_text/xml/2010/04/08/2010-7965.xml
U.S. Trustee Program Case Referral System	2004-03-04	https://www.federalregister.gov/documents/full_text/xml/2004/03/04/04-4828.xml
Incident Investigation/Police Inquiry Files.	2010-04-08	https://www.federalregister.gov/documents/full_text/xml/2010/04/08/2010-7990.xml
Criminal Investigative Files of the Inspector General HHS/OS/OIG. 	2008-03-04	https://www.federalregister.gov/documents/full_text/xml/2008/03/04/E8-4105.xml
Secure Facilities Repository Records.	2010-04-08	https://www.federalregister.gov/documents/full_text/xml/2010/04/08/2010-7960.xml
What Works Clearinghouse (WWC) Database. 	2004-03-01	https://www.federalregister.gov/documents/full_text/xml/2004/03/01/04-4514.xml
Training and Employee Development Record System (August 11, 2010, 75 FR 48655)	2013-03-05	https://www.federalregister.gov/documents/full_text/xml/2013/03/05/2013-05027.xml
DHS/CBP-009 Electronic System for Travel Authorization (ESTA)	2012-07-30	https://www.federalregister.gov/documents/full_text/xml/2012/07/30/2012-18552.xml
Air Reserve Personnel Center (ARPC) Case Management System. 	2008-03-03	https://www.federalregister.gov/documents/full_text/xml/2008/03/03/08-915.xml
Payroll, Attendance, Retirement and Leave Records.	2010-04-08	https://www.federalregister.gov/documents/full_text/xml/2010/04/08/2010-7942.xml
Phoenix Financial Management System.	2012-07-27	https://www.federalregister.gov/documents/full_text/xml/2012/07/27/2012-17975.xml
Public Health and National Health Service Corps (PH/NHSC) Scholarship Training Program, the Physician Shortage Area Scholarship Program (PSASP), National Health Service Corps Scholarship Program (NHSC SP), National Health Service Corps Loan Repayment Program (NHSC LRP), NHSC Student/Resident Experiences and Rotations in Community Health (SEARCH), Nursing Education Loan Repayment Program (NELRP), Nursing Scholarship Program (NSP), Native Hawaiian Health Scholarship Program (NHHSP), and Faculty Loan Repayment Program (FLRP), Applicants and/or Participants Records System, HHS/HRSA/BCRS.	2010-04-08	https://www.federalregister.gov/documents/full_text/xml/2010/04/08/2010-7923.xml
Information Technology and Control Records. 	2008-03-03	https://www.federalregister.gov/documents/full_text/xml/2008/03/03/E8-4048.xml
Commercial Use Authorization (CUA) System—NPS-24.	2013-04-08	https://www.federalregister.gov/documents/full_text/xml/2013/04/08/2013-08028.xml
Patent Licenses and Assignments.	2004-02-25	https://www.federalregister.gov/documents/full_text/xml/2004/02/25/04-4044.xml
Freedom of Information Act File (FOIA) (August 23, 1995, 60 FR 43778). 	2008-02-29	https://www.federalregister.gov/documents/full_text/xml/2008/02/29/E8-3914.xml
DHS/USCIS-014 Electronic Immigration System-1 Temporary Accounts and Draft Benefit Requests System of Records	2013-04-05	https://www.federalregister.gov/documents/full_text/xml/2013/04/05/2013-07770.xml
Delete entry and replace with “AF e-Learning System.”	2012-07-26	https://www.federalregister.gov/documents/full_text/xml/2012/07/26/2012-18263.xml
Broadband Dead Zone Report and Consumer Broadband Test.	2010-04-07	https://www.federalregister.gov/documents/full_text/xml/2010/04/07/2010-7988.xml
DHS/USCIS-015 Electronic Immigration System-2 Account and Case Management System of Records	2013-04-05	https://www.federalregister.gov/documents/full_text/xml/2013/04/05/2013-07725.xml
Delete entry and replace with “Selective Reenlistment Bonus and/or Advance Payment Request.”	2012-07-26	https://www.federalregister.gov/documents/full_text/xml/2012/07/26/2012-18259.xml
DoD Civilian/Military Service Review Board. 	2008-02-29	https://www.federalregister.gov/documents/full_text/xml/2008/02/29/E8-3909.xml
Defense Eligibility Records.	2004-02-25	https://www.federalregister.gov/documents/full_text/xml/2004/02/25/04-4045.xml
Grain Inspection, Packers and Stockyards Administration, USDA/GIPSA-1, Packers and Stockyards Automated System (PAS).	2013-04-03	https://www.federalregister.gov/documents/full_text/xml/2013/04/03/2013-07671.xml
Voluntary Leave Transfer Program Records.	2010-04-02	https://www.federalregister.gov/documents/full_text/xml/2010/04/02/2010-7383.xml
Inspector General Investigative Files—FCA. 	2004-02-25	https://www.federalregister.gov/documents/full_text/xml/2004/02/25/04-4049.xml
Home Affordable Modification Program Records—Treasury/DO.	2011-06-24	https://www.federalregister.gov/documents/full_text/xml/2011/06/24/2011-15860.xml
Driver Record Monitoring System (DRMS). 	2008-02-29	https://www.federalregister.gov/documents/full_text/xml/2008/02/29/E8-3915.xml
Marine Corps Mobilization Processing System (MCMPS) Records	2010-04-02	https://www.federalregister.gov/documents/full_text/xml/2010/04/02/2010-7385.xml
Travel Charge Card Program.	2013-04-03	https://www.federalregister.gov/documents/full_text/xml/2013/04/03/2013-07669.xml
Indian Health Service Sanitation Facilities Construction Individual Applicant Records, HHS/IHS/OEHE.	2008-02-28	https://www.federalregister.gov/documents/full_text/xml/2008/02/28/08-865.xml
National Intelligence Council (NIC) Consultation Records (ODNI-15).	2010-04-02	https://www.federalregister.gov/documents/full_text/xml/2010/04/02/2010-7535.xml
Office of Inspector General—Investigative File System, 300.010. 	2004-02-25	https://www.federalregister.gov/documents/full_text/xml/2004/02/25/04-4203.xml
Parking and Transit System (PATS)	2013-04-02	https://www.federalregister.gov/documents/full_text/xml/2013/04/02/2013-07581.xml
Travel Input Records (September 4, 2007; 72 FR 50666).	2010-03-30	https://www.federalregister.gov/documents/full_text/xml/2010/03/30/2010-7057.xml
U.S. Citizenship and Immigration Services Verification Information System (VIS). 	2008-02-28	https://www.federalregister.gov/documents/full_text/xml/2008/02/28/E8-3833.xml
Federal Emergency Management Agency—003 National Flood Insurance Program Files. 	2008-12-19	https://www.federalregister.gov/documents/full_text/xml/2008/12/19/E8-29794.xml
NASA Guest Operations System.	2013-04-02	https://www.federalregister.gov/documents/full_text/xml/2013/04/02/2013-07590.xml
Health Professions Analysis and Evaluation, HHS/HRSA/BHPr.	2010-03-29	https://www.federalregister.gov/documents/full_text/xml/2010/03/29/2010-6878.xml
Patent Examiner Testimony Files.	2013-04-01	https://www.federalregister.gov/documents/full_text/xml/2013/04/01/2013-07390.xml
DHS/FEMA—009 Hazard Mitigation Assistance Grant Programs System of Records.	2012-07-23	https://www.federalregister.gov/documents/full_text/xml/2012/07/23/2012-17783.xml
Deployment Management Records	2010-03-26	https://www.federalregister.gov/documents/full_text/xml/2010/03/26/2010-6689.xml
Defense Civilian Pay System (DCPS). 	2008-12-12	https://www.federalregister.gov/documents/full_text/xml/2008/12/12/E8-29404.xml
Petitioners for License to File for Foreign Patents.	2013-04-01	https://www.federalregister.gov/documents/full_text/xml/2013/04/01/2013-07393.xml
Office Visitor/Commercial Solicitor Files (November 18, 2003, 68 FR 65045).	2004-02-23	https://www.federalregister.gov/documents/full_text/xml/2004/02/23/04-3769.xml
Patent Assignment Records.	2013-03-29	https://www.federalregister.gov/documents/full_text/xml/2013/03/29/2013-07378.xml
Space Command Operations Training	2010-03-26	https://www.federalregister.gov/documents/full_text/xml/2010/03/26/2010-6688.xml
Patent Application Files. (Note: This notice is broken down, where indicated, into three subsystems relating to the status of the files: a. Pending; b. Abandoned; and c. Patented.)	2013-03-29	https://www.federalregister.gov/documents/full_text/xml/2013/03/29/2013-07341.xml
DHS FEMA—012 Suspicious Activity Reporting.	2011-09-28	https://www.federalregister.gov/documents/full_text/xml/2011/09/28/2011-24934.xml
DoD Personnel Accountability and Assessment System.	2010-03-24	https://www.federalregister.gov/documents/full_text/xml/2010/03/24/2010-6456.xml
“Medicare Administrative Issue Tracker and Reporting of Operations (MAISTRO) System,” HHS/CMS/OEA. 	2008-02-27	https://www.federalregister.gov/documents/full_text/xml/2008/02/27/E8-3678.xml
Patent Application Secrecy Order Files.	2013-03-29	https://www.federalregister.gov/documents/full_text/xml/2013/03/29/2013-07377.xml
Department of Transportation/Office of the Inspector General—100 Investigative Record System.	2012-07-20	https://www.federalregister.gov/documents/full_text/xml/2012/07/20/2012-17696.xml
Defense Travel System	2010-03-24	https://www.federalregister.gov/documents/full_text/xml/2010/03/24/2010-6455.xml
Life Long Learning Center.	2010-11-15	https://www.federalregister.gov/documents/full_text/xml/2010/11/15/2010-28750.xml
General Correspondence Files.	2004-02-23	https://www.federalregister.gov/documents/full_text/xml/2004/02/23/04-3768.xml
Housing Referral Services Record System (February 22, 1993, 58 FR 10817). 	2008-02-26	https://www.federalregister.gov/documents/full_text/xml/2008/02/26/E8-3600.xml
Accounting Systems for the Department of Justice (DOJ).	2010-03-22	https://www.federalregister.gov/documents/full_text/xml/2010/03/22/2010-6213.xml
Enrollment Database (EDB), HHS/CMS/CBC. 	2008-02-26	https://www.federalregister.gov/documents/full_text/xml/2008/02/26/E8-3562.xml
Uniformed Services Identification Card.	2013-03-27	https://www.federalregister.gov/documents/full_text/xml/2013/03/27/2013-06965.xml
Department of Defense Readiness Reporting System (DRRS) (December 10, 2004; 69 FR 71803).	2010-03-18	https://www.federalregister.gov/documents/full_text/xml/2010/03/18/2010-5963.xml
“1-800 Medicare Helpline (HELPLINE),” HHS/CMS/CBC. 	2008-02-26	https://www.federalregister.gov/documents/full_text/xml/2008/02/26/E8-3564.xml
Identity Management (IDM)	2010-03-18	https://www.federalregister.gov/documents/full_text/xml/2010/03/18/2010-5962.xml
NSA/CSS Morale, Welfare, and Recreation (MWR) and Non-appropriated Fund Instrumentality (NAFI) Files. 	2005-07-06	https://www.federalregister.gov/documents/full_text/xml/2005/07/06/05-13203.xml
Compensation, Pension, Education, and Vocational Rehabilitation and Employment Records-VA.	2012-07-19	https://www.federalregister.gov/documents/full_text/xml/2012/07/19/2012-17507.xml
PEGASYS CARDKEY.	2010-03-18	https://www.federalregister.gov/documents/full_text/xml/2010/03/18/2010-5955.xml
Emergency Relocation Group (ERG) Roster Files (January 30, 2002, 67 FR 4411).	2013-03-21	https://www.federalregister.gov/documents/full_text/xml/2013/03/21/2013-06539.xml
DHS/USCIS-016 Electronic Immigration System-3 Automated Background Functions.	2011-09-28	https://www.federalregister.gov/documents/full_text/xml/2011/09/28/2011-24933.xml
Patriot Excalibur (PEX) System Records.	2010-03-18	https://www.federalregister.gov/documents/full_text/xml/2010/03/18/2010-5952.xml
Project Management Records. 	2004-02-23	https://www.federalregister.gov/documents/full_text/xml/2004/02/23/04-3763.xml
Department of Transportation Federal Motor Carrier Safety Administration Pre-Employment Screening Program.	2012-07-19	https://www.federalregister.gov/documents/full_text/xml/2012/07/19/2012-17597.xml
Delete entry and replace with “Enlisted Promotion Testing Record.”	2013-03-21	https://www.federalregister.gov/documents/full_text/xml/2013/03/21/2013-06489.xml
Active Directory Enterprise Application and Services Forest (AD EASF).	2010-11-15	https://www.federalregister.gov/documents/full_text/xml/2010/11/15/2010-28754.xml
Delete and replace with “Defense Automated Management Information System (DAMIS).” 	2008-02-21	https://www.federalregister.gov/documents/full_text/xml/2008/02/21/E8-3210.xml
Delete entry and replace with “DLA Telework Program Records”.	2013-03-21	https://www.federalregister.gov/documents/full_text/xml/2013/03/21/2013-06490.xml
USDA/FNS-11, Information on Persons Identified as Responsible for Serious Deficiencies, Proposed for Disqualification, or Disqualified to Participate as Principals or Family Day Care Home Operators in the Child and Adult Care Food Program (CACFP). 	2004-02-12	https://www.federalregister.gov/documents/full_text/xml/2004/02/12/04-3116.xml
Delete entry and replace with “Military On-Line Personnel System.”	2013-03-21	https://www.federalregister.gov/documents/full_text/xml/2013/03/21/2013-06540.xml
DIA Military Awards Files.	2010-03-18	https://www.federalregister.gov/documents/full_text/xml/2010/03/18/2010-5959.xml
Identification Card Control (January 4, 2000, 65 FR 291). 	2008-02-21	https://www.federalregister.gov/documents/full_text/xml/2008/02/21/E8-3290.xml
Customer Call Center, Assistance and Satisfaction Survey Records.	2013-03-19	https://www.federalregister.gov/documents/full_text/xml/2013/03/19/2013-06263.xml
Office General Counsel Electronic Discovery Management System. 	2012-07-17	https://www.federalregister.gov/documents/full_text/xml/2012/07/17/2012-17365.xml
Sexual Assault (SADMS) and Sexual Harassment (SHARP) Program Records.	2010-03-18	https://www.federalregister.gov/documents/full_text/xml/2010/03/18/2010-5961.xml
Invention Disclosure.	2004-02-06	https://www.federalregister.gov/documents/full_text/xml/2004/02/06/04-2540.xml
Navy Standard Integrated Personnel System (NSIPS). 	2005-07-06	https://www.federalregister.gov/documents/full_text/xml/2005/07/06/05-13198.xml
DHS/USCIS-014 Electronic Immigration System-1 Temporary Accounts and Draft Benefit Requests System of Records.	2011-09-28	https://www.federalregister.gov/documents/full_text/xml/2011/09/28/2011-24936.xml
Air Force Institute of Technology Management and Information System (AFITMIS). 	2008-02-21	https://www.federalregister.gov/documents/full_text/xml/2008/02/21/E8-3209.xml
